{"case_id":"C026","impact_scope":[{"type":"input_semantic_change","files":["std/jpeg/decode_jpeg.wuffs"],"functions":["decoder.do_decode_frame"],"description":"Changes the existing handling of a work buffer shorter than components_workbuf_offsets[8]: non-lower-quality decoding now reports bad workbuf length, while the accepted lower-quality case always enables immediate swizzling. The supplied public restart_frame declaration is unchanged and does not belong to this change."}],"gap_before":{"exists":true,"type":"input_semantic_exposure_gap","evidence":["In S0, exercising the exact short-work-buffer branch required the caller to pass decode_frame a work buffer shorter than components_workbuf_offsets[8].","H0 always allocates decoder.workbuf_len().max_incl and passes that full buffer to decode_frame, so it did not deliberately expose the short-work-buffer behavior in S0."]},"gap_after":{"exists":true,"type":"input_semantic_exposure_gap","evidence":["S1 changes results within the same existing short-work-buffer and lower-quality control space; it does not add a new public callable, argument, configuration, or lifecycle transition.","Unchanged H0 still allocates decoder.workbuf_len().max_incl and passes the full buffer, so it does not deliberately expose that same short-work-buffer behavior in S1."]},"new_harness_obligation":{"exists":false,"description":"The caller-visible obligation remains varying the existing decode_frame work-buffer length, with lower-quality mode as an existing internal/configuration condition. S1 changes internal validation and swizzling decisions but does not require a new H0 action compared with S0.","evidence":["decode_frame is already reached through fuzz_image_decoder with its existing workbuf parameter.","The diff changes only private do_decode_frame logic and introduces no new caller-supplied value, buffer kind, call order, configuration surface, or special input construction.","The mechanically selected public restart_frame declaration is identical in S0 and S1."]},"explicit_failure":false,"delta_attribution":"UNCHANGED","maintenance_needed":false,"confidence":97,"reason":"For the smallest changed semantic unit—short-work-buffer handling inside decoder.do_decode_frame—the same exposure gap exists on both sides because H0 always supplies the advertised full work buffer. The commit alters behavior within that pre-existing caller-controlled dimension but does not create or aggravate a harness obligation."}