{"case_id":"T5019","impact_scope":[{"type":"new_entry_point","files":["spng/spng.c","spng/spng.h"],"functions":["spng_encode_scanline"],"description":"S1 introduces the public progressive-encoding scanline entry point anchored by the selected declaration context."},{"type":"api_protocol_change","files":["spng/spng.c","spng/spng.h"],"functions":["spng_encode_image","spng_encode_scanline"],"description":"The new entry point is reached by initializing encoding with SPNG_ENCODE_PROGRESSIVE and then supplying scanlines through caller-controlled calls."}],"gap_before":{"exists":false,"type":"unit_absent","evidence":["S0 has no matching declaration for spng_encode_scanline in the selected production files.","Because the anchored public entry point did not exist in S0, H0 had no obligation to expose it."]},"gap_after":{"exists":true,"type":"missing_new_public_entry_point_and_lifecycle","evidence":["S1 declares and implements spng_encode_scanline(spng_ctx *, const void *, size_t).","H0 exercises PNG decoding only and never initializes progressive encoding or calls spng_encode_scanline."]},"new_harness_obligation":{"exists":true,"description":"H0 must add an encoding path that initializes spng_encode_image with SPNG_ENCODE_PROGRESSIVE and then makes caller-controlled spng_encode_scanline calls with scanline buffers, lengths, and valid lifecycle ordering.","evidence":["SPNG_ENCODE_PROGRESSIVE makes spng_encode_image return after encoder initialization.","Progress then depends on explicit calls to the newly introduced spng_encode_scanline entry point.","This call, its caller-supplied buffer and length, and its ordering were unnecessary in S0 because the entry point was absent."]},"explicit_failure":false,"delta_attribution":"NEW","maintenance_needed":true,"confidence":99,"reason":"The anchored public callable is absent in S0 and introduced in S1. H0 does not expose it, so the same-scope gap changes from false to true and creates a concrete new caller-visible harness obligation."}