{"case_id":"C022","impact_scope":[{"type":"new_entry_point","files":["std/tga/decode_tga.wuffs"],"functions":["decoder.frame_dirty_rect"],"description":"Introduces the public TGA decoder.frame_dirty_rect callable anchored in the supplied S1 declaration context."}],"gap_before":{"exists":false,"type":"declaration_absent","evidence":["S0 has no matching declaration in the selected source file, so this callable and its exposure obligation did not exist."]},"gap_after":{"exists":true,"type":"unexercised_public_callable","evidence":["S1 introduces pub func decoder.frame_dirty_rect() in std/tga/decode_tga.wuffs.","H0 compiles only the JSON-related modules and calls JSON decoder APIs; it neither enables the TGA module nor constructs or calls a TGA decoder."]},"new_harness_obligation":{"exists":true,"description":"To expose this new callable, H0 would need to enable the TGA module, construct and advance a TGA decoder as needed, and call decoder.frame_dirty_rect; none of those TGA-specific harness actions existed in S0.","evidence":["The anchored callable is absent in S0 and public in S1.","H0 defines WUFFS_CONFIG__MODULE__JSON but no TGA module and contains no TGA decoder entry or call."]},"explicit_failure":false,"delta_attribution":"NEW","maintenance_needed":true,"confidence":97,"reason":"For the identical anchored unit, Gap(S0,H0) is false because decoder.frame_dirty_rect did not exist, while Gap(S1,H0) is true because the newly introduced public TGA callable is not reachable from the unchanged JSON-only harness. This creates a concrete new harness entry/call and configuration obligation, so the fixed truth table yields NEW and maintenance is needed."}