{"case_id":"C023","impact_scope":[{"type":"new_entry_point","files":["std/webp/decode_webp.wuffs"],"functions":["decoder.decode_image_config","decoder.decode_frame_config","decoder.decode_frame","decoder.restart_frame","decoder.tell_me_more"],"description":"S1 introduces a new public WebP image-decoder implementation and its caller-facing decoding entry points; no corresponding declaration exists in S0."},{"type":"state_change","files":["std/webp/decode_webp.wuffs"],"functions":["decoder.do_decode_image_config","decoder.do_decode_frame_config","decoder.do_decode_frame","decoder.restart_frame"],"description":"The new decoder exposes a call-order protocol through call_sequence, including configuration, frame decoding, end-of-data, and restart states."},{"type":"input_semantic_change","files":["std/webp/decode_webp.wuffs"],"functions":["decoder.decode_image_config","decoder.decode_frame_config","decoder.decode_frame"],"description":"S1 creates a new WebP-format input surface using caller-supplied I/O readers, output/configuration objects, pixel buffers, and work buffers."},{"type":"internal_only","files":["std/vp8/decode_vp8.wuffs"],"functions":[],"description":"The new VP8 file is explicitly a placeholder dependency and adds no decoding operation or input-processing behavior."}],"gap_before":{"exists":false,"type":"none","evidence":["S0 has no matching WebP decoder declaration or WebP decoding entry point in the selected production scope.","Because the WebP decoder and its call protocol do not exist in S0, H0 has no S0 WebP exposure or control obligation to omit."]},"gap_after":{"exists":true,"type":"missing exposure and protocol control for a new public decoder","evidence":["S1 adds std/webp/decode_webp.wuffs with a public decoder implementing base.image_decoder and public decode_image_config, decode_frame_config, decode_frame, restart_frame, and tell_me_more operations.","H0 enables only AUX/BASE/JSON modules and invokes JSON decoding APIs; it neither enables or constructs the WebP decoder nor supplies WebP bytes, image/frame configurations, pixel/work buffers, or call-sequence transitions."]},"new_harness_obligation":{"exists":true,"description":"To exercise the new S1 surface, a harness must enable and instantiate the WebP decoder, construct WebP-oriented input and decoder arguments, and drive its image-config, frame-config, frame-decode, and restart call-order transitions. None of these actions was needed in S0.","evidence":["The entire WebP decoder and its public API are newly added in S1.","The new methods require caller-supplied I/O readers and, depending on the call, configuration destinations, a pixel buffer, blend mode, work buffer, options, or restart arguments.","H0 is a JSON-only harness and performs none of these calls or constructions."]},"explicit_failure":false,"delta_attribution":"NEW","maintenance_needed":true,"confidence":99,"reason":"Within the stable scope of the newly introduced WebP decoder, S0 has no relevant API and therefore no harness gap, while S1 adds a public format entry surface and stateful image-decoder protocol that unchanged H0 cannot reach or control. This is a concrete new harness obligation, so the delta is NEW and maintenance is needed."}