{"case_id":"T5039","impact_scope":[{"type":"state_change","files":["spng/spng.c"],"functions":["spng_set_plte"],"description":"The existing setter changes how the supplied palette is copied into context state: S0 assigns the entire structure, while S1 copies n_entries and only that many palette entries."}],"gap_before":{"exists":true,"type":"direct API exposure gap","evidence":["S0 already contains the public spng_set_plte(ctx, plte) callable.","H0 never calls spng_set_plte or otherwise exercises the palette-setting path; spng_get_plte is a distinct getter path."]},"gap_after":{"exists":true,"type":"direct API exposure gap","evidence":["S1 retains the same spng_set_plte(ctx, plte) signature, prerequisites, validation, and caller-supplied arguments.","H0 remains unchanged and still never calls spng_set_plte, so the modified copy behavior is not exposed."]},"new_harness_obligation":{"exists":false,"description":"S1 introduces no new caller-visible entry, value, buffer, configuration, or call-order requirement. Exercising the changed behavior requires the same setter call and inputs already required in S0.","evidence":["The declaration and parameters of spng_set_plte are identical in S0 and S1.","The only change is internal copying after the existing IHDR prerequisite and palette validation."]},"explicit_failure":false,"delta_attribution":"UNCHANGED","maintenance_needed":false,"confidence":99,"reason":"The principal unit is the existing spng_set_plte callable, not the related getter or the broader encoding subsystem. H0 omits this same setter path before and after, and the internal replacement of whole-structure assignment with bounded field copying creates no additional harness action or reduced reachability."}