{"case_id":"T5031","impact_scope":[{"type":"internal_only","files":["spng/spng.c"],"functions":["spng_encode_image","write_idat_bytes"],"description":"The existing spng_encode_image path now initializes the first IDAT output buffer and encoder state directly before encoding rows; this responsibility was moved out of the internal write_idat_bytes helper without changing caller-supplied arguments, configuration, or call order."}],"gap_before":{"exists":true,"type":"existing callable exposure gap","evidence":["S0 already declares spng_encode_image(spng_ctx *ctx, const void *img, size_t len, int fmt, int flags).","H0 exercises PNG decoding APIs but never calls spng_encode_image or otherwise enters the encoding path."]},"gap_after":{"exists":true,"type":"existing callable exposure gap","evidence":["S1 retains the same spng_encode_image declaration and caller-visible parameters.","H0 remains unchanged and still never calls spng_encode_image; the new write_header invocation, zlib output setup, and state assignment occur automatically inside that omitted callable."]},"new_harness_obligation":{"exists":false,"description":"No new H0 action is required relative to S0. Reaching the changed behavior requires the same previously omitted spng_encode_image call, with no new caller-supplied value, buffer, configuration, or lifecycle transition.","evidence":["The public callable identity and signature are identical in S0 and S1.","The diff only relocates first-IDAT initialization between spng_encode_image and its internal helper write_idat_bytes.","S1 introduces no caller-visible parameter, configuration control, or call-order requirement."]},"explicit_failure":false,"delta_attribution":"UNCHANGED","maintenance_needed":false,"confidence":99,"reason":"For the anchored unit spng_encode_image, H0 has the same direct exposure gap before and after the commit. The added initialization is internal behavior reached automatically by the existing call, so it neither creates a new harness obligation nor aggravates the pre-existing omission."}