{"case_id":"T5023","impact_scope":[{"type":"input_semantic_change","files":["spng/spng.c"],"functions":["spng_encode_image"],"description":"The existing encoder entry point now rejects indexed-color images when the context has no stored palette, returning SPNG_ENOPLTE before encoding."}],"gap_before":{"exists":true,"type":"direct API exposure gap","evidence":["S0 already declares and implements spng_encode_image(spng_ctx *, const void *, size_t, int, int).","H0 only configures and exercises PNG decoding paths and never calls spng_encode_image."]},"gap_after":{"exists":true,"type":"direct API exposure gap","evidence":["S1 retains the same spng_encode_image callable surface and adds an internal precondition check for indexed color without a stored palette.","Unchanged H0 still never calls spng_encode_image, so it does not exercise either the existing encoder behavior or the new SPNG_ENOPLTE result."]},"new_harness_obligation":{"exists":false,"description":"The added palette validation is internal behavior within the same already-omitted encoder API; it introduces no new entry point, caller argument, buffer, call ordering, configuration, or special construction required for H0 to reach that API.","evidence":["The signature and means of calling spng_encode_image are unchanged between S0 and S1.","Exercising the changed branch would use the pre-existing encoder setup surface: an indexed-color IHDR with no stored palette.","H0 omitted the entire spng_encode_image callable before and after the change."]},"explicit_failure":false,"delta_attribution":"UNCHANGED","maintenance_needed":false,"confidence":99,"reason":"The principal unit is the existing spng_encode_image API. Its direct exposure gap is true in both snapshots because H0 is decode-only. Adding an early validation return inside that same omitted callable changes behavior but creates no new caller-visible harness obligation, so the gap is UNCHANGED and the fixed rule does not require maintenance."}