{"case_id":"C039","impact_scope":[{"type":"input_semantic_change","files":["std/gif/decode_gif.wuffs","std/gif/common_consts.wuffs"],"functions":["decoder.tell_me_more?","decoder.do_tell_me_more?"],"description":"The existing public GIF decoder.tell_me_more? callable now wraps its extracted private implementation and converts a short-read status on a closed source into the new public #truncated input status."}],"gap_before":{"exists":true,"type":"omitted_existing_public_metadata_lifecycle_path","evidence":["S0 declares public decoder.tell_me_more? with dst, minfo, and src parameters.","H0 invokes image configuration, frame configuration, and frame decoding through fuzz_image_decoder, but never calls decoder.set_report_metadata! or decoder.tell_me_more?."]},"gap_after":{"exists":true,"type":"omitted_existing_public_metadata_lifecycle_path","evidence":["S1 retains the same public decoder.tell_me_more? signature and delegates to private decoder.do_tell_me_more?.","H0 remains unable to exercise the callable's new closed-source short-read conversion because it still neither enables metadata reporting nor calls tell_me_more?."]},"new_harness_obligation":{"exists":false,"description":"The change alters status handling inside the same omitted public callable; it does not introduce a new H0 entry, argument, buffer, configuration, call-order transition, or special input construction relative to S0.","evidence":["The public decoder.tell_me_more? parameters are identical in S0 and S1.","The new status check uses the already supplied src and its existing closed state internally.","Reaching this behavior still requires the same metadata-reporting and tell_me_more? lifecycle path that H0 omitted in S0."]},"explicit_failure":false,"delta_attribution":"UNCHANGED","maintenance_needed":false,"confidence":99,"reason":"For the anchored decoder.tell_me_more? exposure obligation, Gap(S0,H0) and Gap(S1,H0) are both true. The new wrapper and #truncated input result add internal behavior to the same callable without changing how the harness must reach or control it, so the omission is unchanged and does not trigger maintenance."}