{"case_id":"C029","impact_scope":[{"type":"new_entry_point","files":["std/sha256/common_sha256.wuffs"],"functions":["hasher.get_quirk","hasher.set_quirk!","hasher.update!","hasher.update_bitvec256!","hasher.checksum_bitvec256"],"description":"S1 adds a new public SHA-256 hasher type and public hashing entry points; no matching production declaration exists in S0."},{"type":"state_change","files":["std/sha256/common_sha256.wuffs"],"functions":["hasher.update!","hasher.checksum_bitvec256"],"description":"The new hasher accepts caller-supplied byte slices across stateful update calls and computes a checksum from the accumulated state."},{"type":"configuration_change","files":["fuzz/c/std/json_fuzzer.cc"],"functions":["fuzz"],"description":"H0 explicitly enables only AUX BASE, AUX JSON, BASE, and JSON modules, so it does not enable the newly added SHA-256 module."}],"gap_before":{"exists":false,"type":"none","evidence":["S0 has no matching SHA-256 declaration in the selected production source.","The new SHA-256 hasher, its update/checksum protocol, and its caller-supplied byte input do not exist in S0, so H0 had no same-scope exposure obligation."]},"gap_after":{"exists":true,"type":"exposure_and_controllability","evidence":["S1 introduces the public hasher and public update!, update_bitvec256!, and checksum_bitvec256 entry points in std/sha256/common_sha256.wuffs.","H0 enables and invokes JSON decoding only; it neither enables SHA-256 nor constructs a SHA-256 hasher, supplies byte slices to update calls, or requests a checksum."]},"new_harness_obligation":{"exists":true,"description":"To exercise the S1 scope, a harness must compile-enable the new SHA-256 module, construct a hasher, feed fuzz-controlled byte slices through update! or update_bitvec256!, and invoke checksum_bitvec256, including stateful update/checksum call sequences that were impossible in S0.","evidence":["The entire SHA-256 production file and its public hasher API are new in S1.","hasher.update! takes a caller-supplied roslice base.u8 and mutates buffered and chaining state.","hasher.checksum_bitvec256 exposes finalization of that accumulated state.","H0's module definitions and fuzz entry path cover JSON only."]},"explicit_failure":false,"delta_attribution":"NEW","maintenance_needed":true,"confidence":99,"reason":"Within the stable scope of the newly introduced SHA-256 public hasher API, S0 had no gap because the API and protocol did not exist. S1 creates public, fuzz-controllable hashing entry points and a stateful update/checksum protocol that unchanged H0 cannot compile-enable or call. This is a concrete new harness obligation, so the delta is NEW and maintenance is needed."}